{
  "schema_version": "p0-contract-v1",
  "current_stage": "stage_2_market_quick_check",
  "updated_at": "2026-06-24T00:00:00",
  "global_blockers": [],
  "next_action": {
    "type": "run_stage",
    "stage_id": "stage_2_market_quick_check",
    "description": "Reuse completed quick snapshots before deciding whether MCP calls are needed."
  },
  "completed_artifacts": [
    "mcp_snapshots/sellersprite_quick_snapshot.json",
    "mcp_snapshots/sorftime_quick_snapshot.json"
  ],
  "stages": {
    "stage_2_market_quick_check": {
      "status": "done",
      "attempts": 1,
      "input_artifacts": [
        "workflow_state.json"
      ],
      "output_artifacts": [
        "mcp_snapshots/sellersprite_quick_snapshot.json",
        "mcp_snapshots/sorftime_quick_snapshot.json"
      ],
      "validation_checks": [
        {
          "name": "snapshot_files_exist",
          "pass": true,
          "detail": "Both quick snapshots are reusable."
        }
      ],
      "last_error": "",
      "next_required_user_action": "",
      "resume_policy": {
        "reuse_existing_artifacts": true,
        "allow_repeat_mcp_call": false,
        "force_refresh": false
      }
    }
  }
}
